{
  "schemaVersion": 1,
  "coordinateUnit": "m",
  "provenance": {
    "source": "Deterministic synthetic demonstration",
    "coordinateSystem": "Local Cartesian coordinates; not georeferenced",
    "conversion": "convert_netcdf.py sample v1; random seed 2026; Z/Y/X; full uint8 range without missing values"
  },
  "synthetic": true,
  "description": "Synthetic folded strata with an inclined fault and displaced layers. Drag to orbit; scroll to zoom.",
  "dimensions": {
    "x": 64,
    "y": 48,
    "z": 40
  },
  "bounds": {
    "x": {
      "min": 0,
      "max": 1200
    },
    "y": {
      "min": 0,
      "max": 900
    },
    "z": {
      "min": -600,
      "max": 0
    }
  },
  "variables": [
    {
      "id": 0,
      "name": "Lithology",
      "file": "lithology.raw",
      "dtype": "uint8",
      "type": "discrete",
      "numClasses": 5,
      "colormap": [
        {
          "value": 0,
          "label": "Clay",
          "color": [
            139,
            90,
            43,
            255
          ]
        },
        {
          "value": 1,
          "label": "Sand",
          "color": [
            255,
            223,
            128,
            255
          ]
        },
        {
          "value": 2,
          "label": "Gravel",
          "color": [
            169,
            169,
            169,
            255
          ]
        },
        {
          "value": 3,
          "label": "Silt",
          "color": [
            194,
            178,
            128,
            255
          ]
        },
        {
          "value": 4,
          "label": "Fault",
          "role": "fault",
          "color": [
            203,
            75,
            61,
            255
          ]
        }
      ]
    },
    {
      "id": 1,
      "name": "Permeability",
      "file": "permeability.raw",
      "dtype": "uint8",
      "type": "continuous",
      "unit": "relative",
      "range": {
        "min": 0,
        "max": 1
      },
      "colormap": [
        {
          "position": 0.0,
          "color": [
            68,
            1,
            84,
            255
          ]
        },
        {
          "position": 0.25,
          "color": [
            59,
            82,
            139,
            255
          ]
        },
        {
          "position": 0.5,
          "color": [
            33,
            145,
            140,
            255
          ]
        },
        {
          "position": 0.75,
          "color": [
            94,
            201,
            98,
            255
          ]
        },
        {
          "position": 1.0,
          "color": [
            253,
            231,
            37,
            255
          ]
        }
      ]
    }
  ]
}